{
  "schemaVersion": 1,
  "domains": [
    {
      "name": "status",
      "description": "Building status",
      "type": "CODED",
      "fieldType": "INT32",
      "values": [
        {
          "code": "1",
          "label": "planned"
        },
        {
          "code": "2",
          "label": "existing"
        }
      ],
      "splitPolicy": "DUPLICATE",
      "mergePolicy": "DEFAULT_VALUE"
    },
    {
      "name": "height",
      "description": "Height in metres",
      "type": "RANGE",
      "fieldType": "FLOAT64",
      "minValue": "0",
      "maxValue": "1000"
    }
  ],
  "datasets": [
    {
      "name": "inspections",
      "kind": "TABLE",
      "fields": [
        {
          "name": "id",
          "type": "INT32",
          "nullable": false
        },
        {
          "name": "building_id",
          "type": "INT32",
          "nullable": false
        },
        {
          "name": "label",
          "type": "STRING",
          "length": 80,
          "nullable": true
        }
      ]
    }
  ],
  "relationships": [
    {
      "name": "building_inspections",
      "origin": "buildings",
      "destination": "inspections",
      "originKey": "id",
      "foreignKey": "building_id",
      "cardinality": "ONE_TO_MANY",
      "forwardLabel": "inspections",
      "backwardLabel": "building"
    }
  ]
}
